"JOURNAL OF TIME SERIES ANALYSIS","J TIME SER ANAL","0143-9782","1467-9892","MATHEMATICS, INTERDISCIPLINARY APPLICATIONS - SCIE","2,308","0.9","Q4","0.39","15.71"%,
"ANZIAM JOURNAL","ANZIAM J","1446-1811","1446-8735","MATHEMATICS, APPLIED - SCIE","530","0.9","Q3","0.38","5"%,
"Journal of Applied Analysis","J APPL ANAL","1425-6908","1869-6082","MATHEMATICS, APPLIED - ESCI","190","0.9","N/A","0.38","2"%,
"QUARTERLY JOURNAL OF MECHANICS AND APPLIED MATHEMATICS","Q J MECH APPL MATH","0033-5614","1464-3855","MATHEMATICS, APPLIED - SCIE","1,494","0.9","Q3","0.37","11.86"%,
"Advances in Mathematics of Communications","ADV MATH COMMUN","1930-5346","1930-5338","MATHEMATICS, APPLIED - SCIE","668","0.9","Q3","0.36","98.97"%,
"JOURNAL OF DYNAMICAL AND CONTROL SYSTEMS","J DYN CONTROL SYST","1079-2724","1573-8698","MATHEMATICS, APPLIED - SCIE","628","0.9","Q3","0.36","7.41"%,
"Games","GAMES-BASEL","N/A","2073-4336","MATHEMATICS, INTERDISCIPLINARY APPLICATIONS - ESCI","534","0.9","N/A","0.32","98.71"%,
"ACM Transactions on Modeling and Computer Simulation","ACM T MODEL COMPUT S","1049-3301","1558-1195","MATHEMATICS, APPLIED - SCIE","781","0.9","Q3","0.31","1.39"%,
"Economic Computation and Economic Cybernetics Studies and Research","ECON COMPUT ECON CYB","0424-267X","1842-3264","MATHEMATICS, INTERDISCIPLINARY APPLICATIONS - SCIE","597","0.9","Q4","0.31","96.55"%,
"INFINITE DIMENSIONAL ANALYSIS QUANTUM PROBABILITY AND RELATED TOPICS","INFIN DIMENS ANAL QU","0219-0257","1793-6306","MATHEMATICS, APPLIED - SCIE","1,126","0.9","Q3","0.3","0"%,
"Journal of Dynamics and Games","J DYN GAMES","2164-6066","2164-6074","MATHEMATICS, INTERDISCIPLINARY APPLICATIONS - ESCI","121","0.9","N/A","0.3","100"%,
"Image Analysis & Stereology","IMAGE ANAL STEREOL","1580-3139","N/A","MATHEMATICS, APPLIED - SCIE","415","0.9","Q3","0.21","87.76"%,
"ANNALS OF PURE AND APPLIED LOGIC","ANN PURE APPL LOGIC","0168-0072","1873-2461","MATHEMATICS, APPLIED - SCIE","1,361","0.8","Q4","0.8","22.98"%,
"Discrete Mathematics Letters","DISCRETE MATH LETT","N/A","2664-2557","MATHEMATICS, APPLIED - ESCI","116","0.8","N/A","0.68","76.86"%,
"FORUM MATHEMATICUM","FORUM MATH","0933-7741","1435-5337","MATHEMATICS, APPLIED - SCIE","1,108","0.8","Q4","0.65","7.58"%,
"Revista Matematica Complutense","REV MAT COMPLUT","1139-1138","1988-2807","MATHEMATICS, APPLIED - SCIE","572","0.8","Q4","0.62","22.22"%,
"JOURNAL OF PURE AND APPLIED ALGEBRA","J PURE APPL ALGEBRA","0022-4049","1873-1376","MATHEMATICS, APPLIED - SCIE","4,523","0.8","Q4","0.6","15.25"%,
"Aequationes Mathematicae","AEQUATIONES MATH","0001-9054","1420-8903","MATHEMATICS, APPLIED - SCIE","1,260","0.8","Q4","0.59","34.07"%,
"Complex Analysis and Operator Theory","COMPLEX ANAL OPER TH","1661-8254","1661-8262","MATHEMATICS, APPLIED - SCIE","926","0.8","Q4","0.57","16.82"%,
"MATHEMATIKA","MATHEMATIKA","0025-5793","2041-7942","MATHEMATICS, APPLIED - SCIE","1,064","0.8","Q4","0.57","15.89"%,
"QUARTERLY OF APPLIED MATHEMATICS","Q APPL MATH","0033-569X","1552-4485","MATHEMATICS, APPLIED - SCIE","3,249","0.8","Q4","0.57","63.44"%,
"JOURNAL OF ALGEBRA AND ITS APPLICATIONS","J ALGEBRA APPL","0219-4988","1793-6829","MATHEMATICS, APPLIED - SCIE","1,840","0.8","Q4","0.56","0.69"%,
"Moscow Mathematical Journal","MOSC MATH J","1609-3321","1609-4514","MATHEMATICS, APPLIED - SCIE","637","0.8","Q4","0.55","0"%,
"Filomat","FILOMAT","0354-5180","0354-5180","MATHEMATICS, APPLIED - SCIE","3,759","0.8","Q4","0.54","99.24"%,
"ARS Mathematica Contemporanea","ARS MATH CONTEMP","1855-3966","1855-3974","MATHEMATICS, APPLIED - SCIE","386","0.8","Q4","0.52","32.5"%,
"Periodica Mathematica Hungarica","PERIOD MATH HUNG","0031-5303","1588-2829","MATHEMATICS, APPLIED - SCIE","718","0.8","Q4","0.52","17.48"%,
"Journal of Integral Equations and Applications","J INTEGRAL EQU APPL","0897-3962","1938-2626","MATHEMATICS, APPLIED - SCIE","440","0.8","Q4","0.5","0"%,
"FUNDAMENTA INFORMATICAE","FUND INFORM","0169-2968","1875-8681","MATHEMATICS, APPLIED - SCIE","1,975","0.8","Q4","0.47","0.8"%,
"ECONOMETRIC THEORY","ECONOMET THEOR","0266-4666","1469-4360","MATHEMATICS, INTERDISCIPLINARY APPLICATIONS - SCIE","3,441","0.8","Q4","0.45","21.82"%,
"Portugaliae Mathematica","PORT MATH","0032-5155","1662-2758","MATHEMATICS, APPLIED - SCIE","424","0.8","Q4","0.44","46"%,
"SIAM JOURNAL ON DISCRETE MATHEMATICS","SIAM J DISCRETE MATH","0895-4801","1095-7146","MATHEMATICS, APPLIED - SCIE","2,543","0.8","Q4","0.41","1.34"%,
"Journal of Geometric Mechanics","J GEOM MECH","1941-4889","1941-4897","MATHEMATICS, APPLIED - SCIE","188","0.8","Q4","0.35","97.33"%,
"Acta Mathematicae Applicatae Sinica-English Series","ACTA MATH APPL SIN-E","0168-9673","1618-3932","MATHEMATICS, APPLIED - SCIE","828","0.8","Q4","0.31","0"%,
"Mathematics in Computer Science","MATH COMPUT SCI","1661-8270","1661-8289","MATHEMATICS, APPLIED - ESCI","369","0.8","N/A","0.29","17.21"%,
"Statistics and Its Interface","STAT INTERFACE","1938-7989","1938-7997","MATHEMATICS, INTERDISCIPLINARY APPLICATIONS - SCIE","770","0.8","Q4","0.2","0"%,
"Electronic Journal of Differential Equations","ELECTRON J DIFFER EQ","1072-6691","N/A","MATHEMATICS, APPLIED - SCIE","2,565","0.7","Q4","0.52","0"%,
"Applications of Mathematics","APPL MATH-CZECH","0862-7940","1572-9109","MATHEMATICS, APPLIED - SCIE","553","0.7","Q4","0.49","0"%,
"Pure and Applied Mathematics Quarterly","PURE APPL MATH Q","1558-8599","1558-8602","MATHEMATICS, APPLIED - SCIE","474","0.7","Q4","0.49","0"%,
"JOURNAL OF NONLINEAR MATHEMATICAL PHYSICS","J NONLINEAR MATH PHY","1402-9251","1776-0852","MATHEMATICS, APPLIED - SCIE","793","0.7","Q4","0.47","64.71"%,
"ACTA MATHEMATICA SINICA-ENGLISH SERIES","ACTA MATH SIN","1439-8516","1439-7617","MATHEMATICS, APPLIED - SCIE","1,924","0.7","Q4","0.46","0"%,
"Journal of Mathematical Analysis","J MATH ANAL","2217-3412","2217-3412","MATHEMATICS, APPLIED - ESCI","298","0.7","N/A","0.44","0"%,
"Minimax Theory and its Applications","MINIMAX THEORY APPL","2199-1413","2199-1421","MATHEMATICS, APPLIED - ESCI","80","0.7","N/A","0.4","0"%,
"ELECTRONIC JOURNAL OF COMBINATORICS","ELECTRON J COMB","1077-8926","1077-8926","MATHEMATICS, APPLIED - SCIE","2,821","0.7","Q4","0.39","88.35"%,
"JOURNAL OF SYMBOLIC COMPUTATION","J SYMB COMPUT","0747-7171","1095-855X","MATHEMATICS, APPLIED - SCIE","2,150","0.7","Q4","0.35","18"%,
"DISCRETE MATHEMATICS AND THEORETICAL COMPUTER SCIENCE","DISCRETE MATH THEOR","1462-7264","1365-8050","MATHEMATICS, APPLIED - SCIE","543","0.7","Q4","0.32","0"%,
"COMPUTATIONAL MATHEMATICS AND MATHEMATICAL PHYSICS","COMP MATH MATH PHYS+","0965-5425","1555-6662","MATHEMATICS, APPLIED - SCIE","2,892","0.7","Q4","0.31","0.21"%,
"Journal of Hyperbolic Differential Equations","J HYPERBOL DIFFER EQ","0219-8916","1793-6993","MATHEMATICS, APPLIED - SCIE","476","0.7","Q4","0.3","0"%,
"Applications and Applied Mathematics-An International Journal","APPL APPL MATH","1932-9466","1932-9466","MATHEMATICS, APPLIED - ESCI","486","0.7","N/A","0.28","0"%,
"COMPEL-THE INTERNATIONAL JOURNAL FOR COMPUTATION AND MATHEMATICS IN ELECTRICAL AND ELECTRONIC ENGINEERING","COMPEL","0332-1649","0332-1649","MATHEMATICS, APPLIED - SCIE","1,067","0.7","Q4","0.24","4.26"%,
"Journal of Computational and Theoretical Transport","J COMPUT THEOR TRANS","2332-4309","2332-4325","MATHEMATICS, APPLIED - SCIE","430","0.7","Q4","0.24","11.29"%,
"APPLICABLE ALGEBRA IN ENGINEERING COMMUNICATION AND COMPUTING","APPL ALGEBR ENG COMM","0938-1279","1432-0622","MATHEMATICS, APPLIED - SCIE","571","0.7","Q4","0.23","10.53"%,
"Review of Symbolic Logic","REV SYMB LOGIC","1755-0203","1755-0211","MATHEMATICS, APPLIED - SCIE","579","0.6","Q4","0.88","18.29"%,
"Analele Stiintifice ale Universitatii Ovidius Constanta-Seria Matematica","AN STI U OVID CO-MAT","1224-1784","1844-0835","MATHEMATICS, APPLIED - SCIE","414","0.6","Q4","0.56","69.77"%,
"RUSSIAN JOURNAL OF NUMERICAL ANALYSIS AND MATHEMATICAL MODELLING","RUSS J NUMER ANAL M","0927-6467","1569-3988","MATHEMATICS, APPLIED - SCIE","286","0.6","Q4","0.49","0"%,
"TOPOLOGY AND ITS APPLICATIONS","TOPOL APPL","0166-8641","1879-3207","MATHEMATICS, APPLIED - SCIE","3,055","0.6","Q4","0.42","6.55"%,
"Computability-The Journal of the Association CiE","COMPUTABILITY","2211-3568","2211-3576","MATHEMATICS, APPLIED - ESCI","77","0.6","N/A","0.4","0"%,
"COMPUTATIONAL GEOMETRY-THEORY AND APPLICATIONS","COMP GEOM-THEOR APPL","0925-7721","1879-081X","MATHEMATICS, APPLIED - SCIE","1,004","0.6","Q4","0.4","25.6"%,
"JOURNAL OF THE KOREAN MATHEMATICAL SOCIETY","J KOREAN MATH SOC","0304-9914","2234-3008","MATHEMATICS, APPLIED - SCIE","909","0.6","Q4","0.4","0"%,
"Annals of Mathematical Sciences and Applications","ANN MATH SCI APPL","2380-288X","2380-2898","MATHEMATICS, INTERDISCIPLINARY APPLICATIONS - ESCI","85","0.6","N/A","0.39","0"%,
"Analysis in Theory and Applications","ANAL THEOR APPL","1672-4070","1573-8175","MATHEMATICS, APPLIED - ESCI","162","0.6","N/A","0.37","100"%,
"CRYPTOLOGIA","CRYPTOLOGIA","0161-1194","1558-1586","MATHEMATICS, APPLIED - SCIE","319","0.6","Q4","0.36","10.2"%,
"ILLINOIS JOURNAL OF MATHEMATICS","ILLINOIS J MATH","0019-2082","1945-6581","MATHEMATICS, APPLIED - ESCI","1,683","0.6","N/A","0.34","0"%,
"Asian Journal of Mathematics","ASIAN J MATH","1093-6106","1945-0036","MATHEMATICS, APPLIED - SCIE","773","0.6","Q4","0.31","0"%,
"Journal of the Korean Society for Industrial and Applied Mathematics","J KOREAN SOC IND APP","1226-9433","1229-0645","MATHEMATICS, APPLIED - ESCI","92","0.6","N/A","0.28","0"%,
"MATHEMATICAL SOCIAL SCIENCES","MATH SOC SCI","0165-4896","1879-3118","MATHEMATICS, INTERDISCIPLINARY APPLICATIONS - SCIE","1,169","0.6","Q4","0.25","23.98"%,
"INTERNATIONAL JOURNAL OF GAME THEORY","INT J GAME THEORY","0020-7276","1432-1270","MATHEMATICS, INTERDISCIPLINARY APPLICATIONS - SCIE","1,385","0.6","Q4","0.23","26.57"%,
"Vestnik Sankt-Peterburgskogo Universiteta Seriya 10 Prikladnaya Matematika Informatika Protsessy Upravleniya","VESTN ST PET U-P MAT","1811-9905","2542-2251","MATHEMATICS, INTERDISCIPLINARY APPLICATIONS - ESCI","94","0.6","N/A","0.21","82"%,
"RAIRO-THEORETICAL INFORMATICS AND APPLICATIONS","RAIRO-THEOR INF APPL","0988-3754","2804-7346","MATHEMATICS, APPLIED - SCIE","264","0.6","Q4","0.2","74.07"%,
"Advances in Data Science and Adaptive Analysis","ADV DATA SCI ADAPT","2424-922X","2424-9238","MATHEMATICS, INTERDISCIPLINARY APPLICATIONS - ESCI","1,163","0.6","N/A","0.13","4.65"%,
"Rendiconti Lincei-Matematica e Applicazioni","REND LINCEI-MAT APPL","1120-6330","1720-0768","MATHEMATICS, APPLIED - SCIE","341","0.5","Q4","0.57","0"%,
"Homology Homotopy and Applications","HOMOL HOMOTOPY APPL","1532-0073","1532-0081","MATHEMATICS, APPLIED - SCIE","446","0.5","Q4","0.41","0"%,
"DIFFERENTIAL GEOMETRY AND ITS APPLICATIONS","DIFFER GEOM APPL","0926-2245","1872-6984","MATHEMATICS, APPLIED - SCIE","977","0.5","Q4","0.4","10.57"%,
"Annals of Combinatorics","ANN COMB","0218-0006","0219-3094","MATHEMATICS, APPLIED - SCIE","577","0.5","Q4","0.38","19.08"%,
"Theory and Applications of Categories","THEOR APPL CATEG","1201-561X","N/A","MATHEMATICS, APPLIED - SCIE","543","0.5","Q4","0.38","0.69"%,
"ARCHIVE FOR HISTORY OF EXACT SCIENCES","ARCH HIST EXACT SCI","0003-9519","1432-0657","MATHEMATICS, INTERDISCIPLINARY APPLICATIONS - SCIE","556","0.5","Q4","0.37","26.56"%,
"Revista de la Union Matematica Argentina","REV UNION MAT ARGENT","0041-6932","1669-9637","MATHEMATICS, APPLIED - SCIE","197","0.5","Q4","0.35","97.7"%,
"CUBO-A Mathematical Journal","CUBO","0716-7776","0719-0646","MATHEMATICS, APPLIED - ESCI","174","0.5","N/A","0.34","87.95"%,
"Proceedings of the Steklov Institute of Mathematics","P STEKLOV I MATH+","0081-5438","1531-8605","MATHEMATICS, APPLIED - SCIE","1,243","0.5","Q4","0.34","0.29"%,
"HISTORIA MATHEMATICA","HIST MATH","0315-0860","1090-249X","MATHEMATICS, INTERDISCIPLINARY APPLICATIONS - SCIE","402","0.5","Q4","0.3","22.45"%,
"Journal of Mathematical Physics Analysis Geometry","J MATH PHYS ANAL GEO","1812-9471","1817-5805","MATHEMATICS, APPLIED - SCIE","159","0.5","Q4","0.3","0"%,
"DYNAMICAL SYSTEMS-AN INTERNATIONAL JOURNAL","DYNAM SYST","1468-9367","1468-9375","MATHEMATICS, APPLIED - SCIE","519","0.5","Q4","0.25","3.33"%,
"Ukrainian Mathematical Journal","UKR MATH J+","0041-5995","1573-9376","MATHEMATICS, APPLIED - SCIE","1,106","0.5","Q4","0.24","0"%,
"Trudy Instituta Matematiki i Mekhaniki UrO RAN","T I MAT MEKH URO RAN","0134-4889","0134-4889","MATHEMATICS, APPLIED - ESCI","237","0.5","N/A","0.22","0"%,
"Memoirs on Differential Equations and Mathematical Physics","MEM DIFFER EQU MATH","1512-0015","1512-0015","MATHEMATICS, APPLIED - ESCI","95","0.5","N/A","0.21","0"%,
"Discrete Mathematics and Applications","DISCRET MATH APPL","0924-9265","1569-3929","MATHEMATICS, APPLIED - ESCI","239","0.5","N/A","0.2","0"%,
"IEICE Nonlinear Theory and Its Applications","IEICE NONLINEAR THEO","2185-4106","2185-4106","MATHEMATICS, INTERDISCIPLINARY APPLICATIONS - ESCI","238","0.5","N/A","0.18","98.76"%,
"P-Adic Numbers Ultrametric Analysis and Applications","P-ADIC NUMBERS ULTRA","2070-0466","2070-0474","MATHEMATICS, INTERDISCIPLINARY APPLICATIONS - ESCI","205","0.5","N/A","0.18","0"%,
"Journal of Applied Nonlinear Dynamics","J APPL NONLINEAR DYN","2164-6457","2164-6473","MATHEMATICS, INTERDISCIPLINARY APPLICATIONS - ESCI","167","0.5","N/A","0.17","0"%,
"Eurasian Journal of Mathematical and Computer Applications","EURASIAN J MATH COMP","2306-6172","2308-9822","MATHEMATICS, INTERDISCIPLINARY APPLICATIONS - ESCI","63","0.5","N/A","0.15","0"%,
"CYBERNETICS AND SYSTEMS ANALYSIS","CYBERN SYST ANAL+","1060-0396","1573-8337","MATHEMATICS, INTERDISCIPLINARY APPLICATIONS - ESCI","797","0.5","N/A","0.12","0"%,
"Revista Internacional de Metodos Numericos para Calculo y Diseno en Ingenieria","REV INT METOD NUMER","0213-1315","N/A","MATHEMATICS, INTERDISCIPLINARY APPLICATIONS - SCIE","162","0.5","Q4","0.12","98.56"%,
"Mathematical Communications","MATH COMMUN","1331-0623","1331-0623","MATHEMATICS, APPLIED - SCIE","356","0.4","Q4","0.48","0"%,
"Annales Mathematicae Silesianae","ANN MATH SILESIANAE","0860-2107","2391-4238","MATHEMATICS, APPLIED - ESCI","93","0.4","N/A","0.34","100"%,
"Glasnik Matematicki","GLAS MAT","0017-095X","1846-7989","MATHEMATICS, APPLIED - SCIE","332","0.4","Q4","0.31","0"%,
"FUNCTIONAL ANALYSIS AND ITS APPLICATIONS","FUNCT ANAL APPL+","0016-2663","1573-8485","MATHEMATICS, APPLIED - SCIE","2,232","0.4","Q4","0.25","0"%,
"TWMS Journal of Applied and Engineering Mathematics","TWMS J APPL ENG MATH","2146-1147","2146-1147","MATHEMATICS, APPLIED - ESCI","278","0.4","N/A","0.21","0"%,
"ADVANCES IN COMPLEX SYSTEMS","ADV COMPLEX SYST","0219-5259","1793-6802","MATHEMATICS, INTERDISCIPLINARY APPLICATIONS - SCIE","659","0.4","Q4","0.2","8.82"%,
"JSIAM Letters","JSIAM LETT","1883-0609","1883-0617","MATHEMATICS, APPLIED - ESCI","84","0.4","N/A","0.14","2.53"%,
"Differential Equations & Applications","DIFFER EQUAT APPL","1847-120X","1848-9605","MATHEMATICS, APPLIED - ESCI","240","0.3","N/A","0.34","96.77"%,
"Funkcialaj Ekvacioj-Serio Internacia","FUNKC EKVACIOJ-SER I","0532-8721","N/A","MATHEMATICS, APPLIED - SCIE","624","0.3","Q4","0.28","0"%,
"ALGEBRA COLLOQUIUM","ALGEBR COLLOQ","1005-3867","0219-1733","MATHEMATICS, APPLIED - SCIE","538","0.3","Q4","0.24","0"%,
"Publications de l Institut Mathematique-Beograd","PUBL I MATH-BEOGRAD","0350-1302","0350-1302","MATHEMATICS, APPLIED - ESCI","412","0.3","N/A","0.24","96.2"%,
"Journal of Combinatorics","J COMB","2156-3527","2150-959X","MATHEMATICS, APPLIED - ESCI","151","0.3","N/A","0.23","0"%,
"Contemporary Mathematics","CONTEMP MATH-SINGAP","2705-1064","2705-1056","MATHEMATICS, APPLIED - ESCI","222","0.3","N/A","0.2","0"%,
"International Journal of Combinatorial Optimization Problems and Informatics","INT J COMB OPTIM PRO","2007-1558","2007-1558","MATHEMATICS, APPLIED - ESCI","81","0.3","N/A","0.2","0"%,
"International Journal of Dynamical Systems and Differential Equations","INT J DYN SYST DIFFE","1752-3583","1752-3591","MATHEMATICS, APPLIED - ESCI","98","0.3","N/A","0.2","0"%,
"Numerical Analysis and Applications","NUMER ANAL APPL","1995-4239","1995-4247","MATHEMATICS, APPLIED - ESCI","172","0.3","N/A","0.2","0"%,
"RENDICONTI DEL SEMINARIO MATEMATICO DELLA UNIVERSITA DI PADOVA","REND SEMIN MAT U PAD","0041-8994","2240-2926","MATHEMATICS, APPLIED - SCIE","467","0.3","Q4","0.19","0"%,
"Journal of Applied Mathematics & Informatics","J APPL MATH INFORM","2734-1194","2234-8417","MATHEMATICS, APPLIED - ESCI","241","0.3","N/A","0.17","0"%,
"Journal of Applied Mathematics Statistics and Informatics","J APPL MATH STAT INF","1336-9180","1339-0015","MATHEMATICS, APPLIED - ESCI","79","0.3","N/A","0.14","100"%,
"Journal of Partial Differential Equations","J PARTIAL DIFFER EQ","2079-732X","1000-940X","MATHEMATICS, APPLIED - ESCI","164","0.3","N/A","0.14","0"%,
"Methods and Applications of Analysis","METHODS APPL ANAL","1073-2772","1945-0001","MATHEMATICS, APPLIED - ESCI","384","0.3","N/A","0.14","0"%,
"International Game Theory Review","INT GAME THEORY REV","0219-1989","1793-6675","MATHEMATICS, INTERDISCIPLINARY APPLICATIONS - ESCI","262","0.3","N/A","0.12","1.1"%,
"Journal of Cellular Automata","J CELL AUTOM","1557-5969","1557-5977","MATHEMATICS, INTERDISCIPLINARY APPLICATIONS - SCIE","121","0.3","Q4","0.11","0"%,
"Uchenye Zapiski Kazanskogo Universiteta-Seriya Fiziko-Matematicheskie Nauki","UCHEN ZAP KAZ U-MAT","2541-7746","2500-2198","MATHEMATICS, APPLIED - ESCI","48","0.3","N/A","0.1","90"%,
"International Journal of Mathematics for Industry","INT J MATH IND","2661-3352","2661-3344","MATHEMATICS, APPLIED - ESCI","16","0.2","N/A","0.41","100"%,
"Bulletin of the South Ural State University Series-Mathematical Modelling Programming & Computer Software","BULL SOUTH URAL STAT","2071-0216","2308-0256","MATHEMATICS, APPLIED - ESCI","147","0.2","N/A","0.19","91.27"%,
"Prikladnaya Diskretnaya Matematika","PRIKL DISKRETN MAT","2071-0410","2311-2263","MATHEMATICS, APPLIED - ESCI","66","0.2","N/A","0.13","0"%,
"Algebra And Discrete Mathematics","ALGEBRA DISCRET MATH","1726-3255","2415-721X","MATHEMATICS, APPLIED - ESCI","215","0.2","N/A","0.12","99.19"%,
"Pacific Journal of Optimization","PAC J OPTIM","1348-9151","1348-9151","MATHEMATICS, APPLIED - SCIE","457","0.2","Q4","0.11","0"%,
"International Journal of Applied Mathematics & Statistics","INT J APPL MATH STAT","0973-1377","0973-7545","MATHEMATICS, APPLIED - ESCI","198","0.2","N/A","0.1","0"%,
"Journal of Mathematics and the Arts","J MATH ARTS","1751-3472","1751-3480","MATHEMATICS, INTERDISCIPLINARY APPLICATIONS - ESCI","84","0.2","N/A","0.08","8.33"%,
"Advances in Differential Equations and Control Processes","ADV DIFFER EQU CONTR","0974-3243","0974-3243","MATHEMATICS, APPLIED - ESCI","54","0.1","N/A","0.11","63.51"%,
"Symmetry-Culture and Science","SYMMETRY-BUDAPEST","0865-4824","2226-1877","MATHEMATICS, INTERDISCIPLINARY APPLICATIONS - ESCI","42","0.1","N/A","0.1","0"%,
"ACM Communications in Computer Algebra","ACM COMMUN COMPUT AL","1932-2232","1932-2240","MATHEMATICS, APPLIED - ESCI","70","0.1","N/A","0.07","0"%,
"Bollettino di Storia delle Scienze Matematiche","B STOR SCI MAT","0392-4432","1724-1650","MATHEMATICS, INTERDISCIPLINARY APPLICATIONS - SCIE","32","0.1","Q4","0.06","0"%,
"Journal of Numerical and Applied Mathematics","J NUMER APPL MATH","0868-6912","0868-6912","MATHEMATICS, APPLIED - ESCI","9","0.1","N/A","0.03","0"%,
"International Journal of Mathematics and Physics","INT J MATH PHYS-KAZA","2218-7987","2409-5508","MATHEMATICS, APPLIED - ESCI","10","<0.1","N/A","0.04","100"%,
"Abakos","ABAKOS","2316-9451","2316-9451","MATHEMATICS, INTERDISCIPLINARY APPLICATIONS - ESCI","10","<0.1","N/A","0.02","0"%,
"Applied Mathematics in Science and Engineering","APPL MATH SCI ENG","N/A","2769-0911","MATHEMATICS, INTERDISCIPLINARY APPLICATIONS - SCIE","31","N/A","N/A","0.14","76.92"%,
"Advances in Continuous and Discrete Models","ADV CONTIN DISCRET M","N/A","2731-4235","MATHEMATICS, APPLIED - SCIE","84","N/A","N/A","N/A","95.83"%,

Copyright (c) 2024 Clarivate 
By exporting the selected data; you agree to the data usage policy set forth in the Terms of Use 
